OBJECTID,Site Name,Brief Description,NHA Join ID,COUNTY_NAM
495,Beaver Run Reservoir,Bald eagles nest along Beaver Run Reservoir.,alj88171,WESTMORELAND
496,Poke Run,NHA site description is incomplete.,alj88172,WESTMORELAND
497,Pucketa Creek,NHA site description is incomplete.,alj88173,WESTMORELAND
498,Little Pucketa Creek,Small creek supports a fish species of concern.,alj88174,WESTMORELAND
499,Loyalhanna Lake,Ospreys nest along Loyalhanna Lake.,alj88175,WESTMORELAND
500,Morring Road,A sensitive species of concern relies on sandy-soiled habitat along Loyalhanna Creek.,alj88176,WESTMORELAND
501,Porters Run,A small forest patch provides habitat for a sensitive species of concern.,alj88177,WESTMORELAND
502,Ten School Road,A sensitive species of concern relies on forested habitat.,alj88178,WESTMORELAND
503,Spruce Run,Open sandy-soiled habitat supports a sensitive species of concern.,alj88179,WESTMORELAND
504,"Chestnut Ridge, Penn View Mountain South",Complex of caves and forested and rocky ridges support many species of concern.,alj88180,WESTMORELAND
505,Harbridge Run,Rich floodplain of a small stream supports several species of concern.,alj88181,WESTMORELAND
506,Orchard Hollow Road,Mesic forest along Snyders Run supports a plant species of concern.,alj88182,WESTMORELAND
507,Tubmill Creek,Tubmill Creek and its tributaries support multiple species of concern.,alj88183,WESTMORELAND
508,"Mills Creek, Macks Run",A fish species of concern relies on the aquatic habitat in Macks Run and Mill Creek.,alj88184,WESTMORELAND
509,Right Fork Mill Creek,A high gradient stream flowing through hardwood forest supports a mammal species of concern.,alj88185,WESTMORELAND
510,Furnace Woods,A rare snail species of concern occurs in a protected forest.,alj88186,WESTMORELAND
511,Tubmill Creek at Lick Run,Rich forest along stream channel supports a rare plant species of concern.,alj88187,WESTMORELAND
521,Chestnut Ridge Park,Wet thickets of Chestnut Ridge County Park supports an invertebrate species of concern.,alj88196,WESTMORELAND
522,Spruce Flats Bog,Swampy forests and bogs support multiple species of concern.,alj87768,WESTMORELAND
570,Stoney Lonesome Woods,Mesic forest supports a plant species of concern.,alj87770,WESTMORELAND
572,Hauger Hood Road Slope,Woodland habitat supports a plant species of concern.,alj87769,WESTMORELAND
573,Linn Run State Park,"Rich hardwood forest, stream valleys, and rocky outcrops support a variety of species of concern.",alj87767,WESTMORELAND
574,Freeman Falls,Rocky outcrops provide suitable habitat for Allehgeny woodrats.,alj87752,WESTMORELAND
576,Laurelville Mennonite Road,A grassland bird is supported by open habitat along the Pennsylvania Turnpike.,alj87750,WESTMORELAND
579,State Game Land #296,Rich forested slopes support multiple species of concern.,alj87733,WESTMORELAND
600,State Game Land #153,"The forested and rocky slopes, abandoned quarries, and caves in and around State Game Lands 153 provide habitat for many species of concern.",alj84565,WESTMORELAND
618,Roaring Run-Armstrong County,"The meadows, open areas, and forests around Roaring Run support several butterfly species of concern.",alj82512,WESTMORELAND
649,Allegheny River Pool #4,"This pool in the Allegheny River, and the surrounding riparian areas, host many species of concern.",alj83344,WESTMORELAND
660,Brinker Run,An osprey nests in a forest patch.,alj87747,WESTMORELAND
661,Powdermill Nature Reserve,"Mix of regenerating fields, forests, and stream valleys support many species of concern.",alj87766,WESTMORELAND
681,Baggaley Roadside,Roadside locations for a plant species of concern.,alj90254,WESTMORELAND
682,Randall Reserve,A shrubby floodplain supports a plant species of concern.,alj90255,WESTMORELAND
683,Clark Hollow,Mesic floodplain forest supports a small population of a plant species of concern.,alj90256,WESTMORELAND
684,Conemaugh River Bend,Habitat captured by a bend in the Conemaugh River supports a plant species of concern.,alj90257,WESTMORELAND
688,Turtle Creek Slopes,The mesic forested slopes above Turtle Creek support sensitive species of concern.,alj90261,WESTMORELAND
689,Avonmore Floodplain,A natural floodplain community occurs along the Kiskiminetas River.,alj90262,WESTMORELAND
697,Charlies Road,Woodlands along the road support a tree species of concern.,alj90273,WESTMORELAND
